{
  "name": "Mangabat",
  "pkg": "ahoge.extension.mangabat",
  "lang": "en",
  "version": "1.0.0",
  "nsfw": 1,
  "sources": [
    {
      "id": "mangabat-en",
      "name": "Mangabat",
      "lang": "en",
      "baseUrl": "https://www.mangabats.com",
      "engine": "mangaBox",
      "rateLimit": 2,
      "nsfw": 1,
      "contentRating": "MIXED",
      "adapter": "mangabox"
    }
  ]
}
