{
  "name": "Bun Manga",
  "pkg": "ahoge.extension.bunmanga",
  "lang": "en",
  "version": "1.0.0",
  "nsfw": 0,
  "sources": [
    {
      "id": "bunmanga-en",
      "name": "Bun Manga",
      "lang": "en",
      "baseUrl": "https://bunmanga.com",
      "engine": "madara",
      "rateLimit": 2,
      "nsfw": 0,
      "contentRating": "SAFE"
    }
  ]
}
