{
  "name": "Mangakakalot",
  "pkg": "ahoge.extension.mangakakalot",
  "lang": "en",
  "version": "1.0.0",
  "nsfw": 1,
  "sources": [
    {
      "id": "mangakakalot-en",
      "name": "Mangakakalot",
      "lang": "en",
      "baseUrl": "https://www.mangakakalot.gg",
      "engine": "mangaBox",
      "rateLimit": 2,
      "nsfw": 1,
      "contentRating": "MIXED",
      "adapter": "mangabox",
      "mirrors": [
        "https://www.mangakakalove.com"
      ]
    }
  ]
}
