{
  "name": "Anikiga",
  "pkg": "ahoge.extension.anikiga",
  "lang": "tr",
  "version": "1.0.0",
  "nsfw": 0,
  "sources": [
    {
      "id": "anikiga-tr",
      "name": "Anikiga",
      "lang": "tr",
      "baseUrl": "https://anikiga.com",
      "engine": "madara",
      "rateLimit": 2,
      "nsfw": 0,
      "contentRating": "SAFE",
      "overrides": {
        "chapterMode": "mangaAjax"
      }
    }
  ]
}
