{
  "name": "ManhuaUS",
  "pkg": "ahoge.extension.manhuaus",
  "lang": "en",
  "version": "1.0.0",
  "nsfw": 0,
  "sources": [
    {
      "id": "manhuaus-en",
      "name": "ManhuaUS",
      "lang": "en",
      "baseUrl": "https://manhuaus.com",
      "engine": "madara",
      "rateLimit": 2,
      "nsfw": 0,
      "contentRating": "SAFE",
      "overrides": {
        "chapterMode": "mangaAjax",
        "filterNonMangaItems": false
      }
    }
  ]
}
