{
  "name": "EZmanga",
  "pkg": "ahoge.extension.ezmanga",
  "lang": "en",
  "version": "1.0.0",
  "nsfw": 0,
  "sources": [
    {
      "id": "ezmanga-en",
      "name": "EZmanga",
      "lang": "en",
      "baseUrl": "https://ezmanga.org",
      "engine": "api",
      "rateLimit": 2,
      "nsfw": 0,
      "contentRating": "SAFE",
      "adapter": "ezmanhwa",
      "apiUrl": "https://vapi.ezmanga.org/api/v1"
    }
  ]
}
