{
  "name": "Kiryuu",
  "pkg": "ahoge.extension.kiryuu",
  "lang": "id",
  "version": "1.0.0",
  "nsfw": 1,
  "sources": [
    {
      "id": "kiryuu-id",
      "name": "Kiryuu",
      "lang": "id",
      "baseUrl": "https://v7.kiryuu.to",
      "engine": "natsuId",
      "rateLimit": 4,
      "nsfw": 1,
      "contentRating": "MIXED",
      "overrides": {
        "chapterListPageOverride": 1
      }
    }
  ]
}
