{
  "name": "Omega Scans",
  "pkg": "ahoge.extension.omegascans",
  "lang": "en",
  "version": "1.0.0",
  "nsfw": 1,
  "sources": [
    {
      "id": "omegascans-en",
      "name": "Omega Scans",
      "lang": "en",
      "baseUrl": "https://omegascans.org",
      "engine": "api",
      "rateLimit": 1,
      "nsfw": 1,
      "contentRating": "NSFW",
      "adapter": "heancms",
      "apiUrl": "https://api.omegascans.org"
    }
  ]
}
